{
  "esquema": "contexto-historico@1",
  "proyecto": "PRY-20260918-el-asedio-de-zamora",
  "estado": "Cerrado",
  "sellado_en": "2026-09-18T14:46:40Z",
  "dimensiones": [
    "tiempo",
    "espacio",
    "demografia",
    "economia",
    "estructura_social",
    "poder_politico",
    "derecho_justicia",
    "religion",
    "mentalidad",
    "ciencia_tecnica",
    "cultura_material",
    "vida_cotidiana",
    "comunicacion_saber",
    "arte_estetica",
    "relaciones_exteriores",
    "conflicto_disidencia",
    "ausencias"
  ],
  "afirmaciones": [
    {
      "id": "AF-0002",
      "enunciado": "Bellido Dolfos asesinó a Sancho II el 7 de octubre de 1072 en el campamento de asedio a Zamora",
      "dimension": "tiempo",
      "estado": "Verificada",
      "fuente": {
        "url": "https://www.espanafascinante.com/articulo/historia/historia-de-bellido-dolfos-zamora/20140421145323273905.html",
        "titulo": "Bellido Dolfos traidor o heroe de Zamora",
        "dominio": "espanafascinante.com",
        "consultada_en": "2026-09-18T00:00:00Z"
      },
      "fragmento": "El 7 de octubre de 1072, a las afueras de la ciudad de Zamora, junto a las murallas, Bellido Dolfos, un noble leonés, acabó con la vida del rey Sancho el Fuerte, clavándole su propia espada en la espalda.",
      "veredicto_ref": "bitacora/e1.jsonl#secuencia:101",
      "intento": 2
    },
    {
      "id": "AF-0003",
      "enunciado": "En el calendario medieval agrícola, julio era el mes de la siega y de las cosechas.",
      "dimension": "tiempo",
      "estado": "Verificada",
      "fuente": {
        "url": "https://www.figzafra.es/calendario-agricola-medieval/",
        "titulo": "Calendario agrícola medieval: El trabajo en la edad media",
        "dominio": "figzafra.es",
        "consultada_en": "2026-09-18T00:00:00Z"
      },
      "fragmento": "Julio era el mes de la siega y de las cosechas, mientras que la trilla era típica de agosto.",
      "veredicto_ref": "bitacora/e1.jsonl#secuencia:13",
      "intento": 1
    },
    {
      "id": "AF-0004",
      "enunciado": "Zamora estaba emplazada sobre una meseta rocosa de 26 a 32 metros de altura al borde del río Duero.",
      "dimension": "espacio",
      "estado": "Verificada",
      "fuente": {
        "url": "https://es.wikipedia.org/wiki/Zamora",
        "titulo": "Zamora - Wikipedia, la enciclopedia libre",
        "dominio": "wikipedia.org",
        "consultada_en": "2026-09-18T00:00:00Z"
      },
      "fragmento": "El núcleo principal del casco antiguo se alza sobre una amplia meseta rocosa de 26 a 32 metros de altura, emplazada al borde del río Duero.",
      "veredicto_ref": "bitacora/e1.jsonl#secuencia:16",
      "intento": 1
    },
    {
      "id": "AF-0005",
      "enunciado": "Zamora llegó a contar con tres recintos amurallados, siendo el primero del siglo XI el mejor conservado.",
      "dimension": "espacio",
      "estado": "Verificada",
      "fuente": {
        "url": "https://es.wikipedia.org/wiki/Zamora",
        "titulo": "Zamora - Wikipedia, la enciclopedia libre",
        "dominio": "wikipedia.org",
        "consultada_en": "2026-09-18T00:00:00Z"
      },
      "fragmento": "La ciudad llegó a contar con tres recintos amurallados, ganando fama como la bien cercada. El primero, construido en el siglo XI, es el mejor conservado.",
      "veredicto_ref": "bitacora/e1.jsonl#secuencia:17",
      "intento": 1
    },
    {
      "id": "AF-0006",
      "enunciado": "El alfoz era un distrito administrativo y fiscal similar a la contribución general pero de extensión más vasta.",
      "dimension": "espacio",
      "estado": "Verificada",
      "fuente": {
        "url": "https://www.figzafra.es/calendario-agricola-medieval/",
        "titulo": "Calendario agrícola medieval: El trabajo en la edad media",
        "dominio": "figzafra.es",
        "consultada_en": "2026-09-18T00:00:00Z"
      },
      "fragmento": "El alfoz era un término similar a la contribución general, aunque de extensión más vasta, siendo un distrito administrativo y fiscal.",
      "veredicto_ref": "bitacora/e1.jsonl#secuencia:18",
      "intento": 1
    },
    {
      "id": "AF-0007",
      "enunciado": "En el siglo XI hubo un incremento significativo de población en las ciudades principales de Zamora",
      "dimension": "demografia",
      "estado": "Verificada",
      "fuente": {
        "url": "https://es.wikipedia.org/wiki/Historia_de_la_provincia_de_Zamora",
        "titulo": "Historia de la provincia de Zamora",
        "dominio": "wikipedia.org",
        "consultada_en": "2026-09-18T00:00:00Z"
      },
      "fragmento": "El esplendor económico y artístico de la provincia comienza en el siglo XI, justo cuando la población se ve incrementada en sus ciudades más importantes",
      "veredicto_ref": "bitacora/e1.jsonl#secuencia:104",
      "intento": 2
    },
    {
      "id": "AF-0008",
      "enunciado": "La esperanza de vida media en el Reino de León medieval era de 24,6 años",
      "dimension": "demografia",
      "estado": "Verificada",
      "fuente": {
        "url": "https://www.diariodeleon.es/cultura/101025/836773/guerra-diezmo-vida-leon-medieval-debajo-30-anos.html",
        "titulo": "La guerra diezmó la vida en el León medieval por debajo de los 30 años",
        "dominio": "diariodeleon.es",
        "consultada_en": "2026-09-18T00:00:00Z"
      },
      "fragmento": "La esperanza de vida media de los habitantes del Reino de León era de 24,6 años",
      "veredicto_ref": "bitacora/e1.jsonl#secuencia:105",
      "intento": 2
    },
    {
      "id": "AF-0009",
      "enunciado": "El trigo era el principal producto agrícola medieval dedicado a la alimentación humana.",
      "dimension": "economia",
      "estado": "Verificada",
      "fuente": {
        "url": "https://www.aytocolladomediano.es/tu-ciudad/historia/raices-historicas/produccion-agropecuaria-en-la-edad-media",
        "titulo": "Producción Agropecuaria en la Edad Media",
        "dominio": "aytocolladomediano.es",
        "consultada_en": "2026-09-18T00:00:00Z"
      },
      "fragmento": "El trigo era el principal producto agrícola y estaba dedicado a la alimentación humana.",
      "veredicto_ref": "bitacora/e1.jsonl#secuencia:27",
      "intento": 1
    },
    {
      "id": "AF-0010",
      "enunciado": "La ganadería medieval suministraba productos al consumo humano en forma de carne y leche, así como lana y cuero para el vestido.",
      "dimension": "economia",
      "estado": "Verificada",
      "fuente": {
        "url": "https://www.aytocolladomediano.es/tu-ciudad/historia/raices-historicas/produccion-agropecuaria-en-la-edad-media",
        "titulo": "Producción Agropecuaria en la Edad Media",
        "dominio": "aytocolladomediano.es",
        "consultada_en": "2026-09-18T00:00:00Z"
      },
      "fragmento": "La ganadería suministraba numerosos productos al consumo humano, tanto para la alimentación (carne, leche) como para el vestido (lana o cuero).",
      "veredicto_ref": "bitacora/e1.jsonl#secuencia:28",
      "intento": 1
    },
    {
      "id": "AF-0011",
      "enunciado": "En el siglo XI el sueldo era una moneda de cuenta base del sistema monetario medieval, equivalente a 12 dineros.",
      "dimension": "economia",
      "estado": "Verificada",
      "fuente": {
        "url": "https://dialnet.unirioja.es/descarga/articulo/3702361.pdf",
        "titulo": "Moneda medieval en el reino de león",
        "dominio": "dialnet.unirioja.es",
        "consultada_en": "2026-09-18T00:00:00Z"
      },
      "fragmento": "El sueldo, como moneda de cuenta, se usará prácticamente para todo tipo de transacciones en las que se marque un valor. El sueldo era una moneda de cuenta base del sistema monetario medieval, equivalente a 12 dineros.",
      "veredicto_ref": "bitacora/e1.jsonl#secuencia:29",
      "intento": 1
    },
    {
      "id": "AF-0012",
      "enunciado": "La libra y la onza funcionaban como unidades de cuenta en el sistema monetario medieval",
      "dimension": "economia",
      "estado": "Verificada",
      "fuente": {
        "url": "https://dialnet.unirioja.es/descarga/articulo/3702361.pdf",
        "titulo": "Moneda medieval en el reino de león",
        "dominio": "dialnet.unirioja.es",
        "consultada_en": "2026-09-18T00:00:00Z"
      },
      "fragmento": "En el sistema monetario libra-onza-sueldo o solidus o dinar califal, las únicas monedas físicas o reales eran los solidus o los dinares, mientras que la libra y su divisor la onza funcionaban como unidades de cuenta.",
      "veredicto_ref": "bitacora/e1.jsonl#secuencia:107",
      "intento": 2
    },
    {
      "id": "AF-0013",
      "enunciado": "Por debajo de la alta nobleza estaban los infanzones, que eran nobles de linaje que combatían a caballo.",
      "dimension": "estructura_social",
      "estado": "Verificada",
      "fuente": {
        "url": "https://www.redalyc.org/journal/3796/379677866002/html/",
        "titulo": "La nobleza castellanoleonesa entre los siglos XI y XII. Sociedad, territorios y memorias",
        "dominio": "redalyc.org",
        "consultada_en": "2026-09-18T00:00:00Z"
      },
      "fragmento": "Por debajo de la alta nobleza estaban los infanzones y los hidalgos (baja nobleza). Los infanzones eran nobles de linaje que combatían a caballo, de ahí que también se les llame caballeros infanzones.",
      "veredicto_ref": "bitacora/e1.jsonl#secuencia:33",
      "intento": 1
    },
    {
      "id": "AF-0014",
      "enunciado": "Desde la segunda mitad del siglo X los infanzones se conocían en lengua romance con una categoría personal de superioridad respecto de los hombres libres.",
      "dimension": "estructura_social",
      "estado": "Verificada",
      "fuente": {
        "url": "https://www.redalyc.org/journal/3796/379677866002/html/",
        "titulo": "La nobleza castellanoleonesa entre los siglos XI y XII. Sociedad, territorios y memorias",
        "dominio": "redalyc.org",